{
  "identifier": "proj-20250629-182909-854",
  "overview": "長岡の花火大会開催に向けた準備プロジェクト",
  "display_name": "長岡の花火大会の準備",
  "created_at": "2025-06-29T18:29:09.854404",
  "created_by": "AI Assistant",
  "status": "DRAFT",
  "schema_version": "1.0",
  "updated_at": "2025-07-01T06:05:53.104313+09:00",
  "change_log": [
    {
      "timestamp": "2025-07-01T06:05:53.104404+09:00",
      "type": "property_patch",
      "changed_fields": [
        "participants_count",
        "start_date",
        "end_date"
      ],
      "description": "Updated 3 properties via generic patch",
      "source": "apply_property_patch",
      "properties_updated": {
        "participants_count": 4,
        "start_date": "2025-08-02",
        "end_date": "2025-08-03"
      }
    }
  ],
  "uuid": "b44455b2-f819-4ea5-bd39-2270fb6c8bc9",
  "tasks": [],
  "phase": "INCEPTION",
  "completion_percentage": "__UNDEFINED__",
  "next_actions": [],
  "blocking_issues": [],
  "phase_requirements": "__UNDEFINED__",
  "phase_history": [],
  "participants_count": 4,
  "start_date": "2025-08-02",
  "end_date": "2025-08-03"
}