{
  "identifier": "proj-20250611-154246-996",
  "overview": "八ヶ岳登山",
  "created_at": "2025-06-11T06:42:46.996447",
  "created_by": "human_user",
  "status": "ACTIVE",
  "schema_version": "1.0",
  "updated_at": "2025-06-11T06:42:50.856713",
  "change_log": [],
  "uuid": "7c463f31-dfdc-46ab-8b1a-456d3ca77acc",
  "tasks": []
}